{
  "schema": "thistle.app.metadata/v1",
  "id": "com.thistle.terminal",
  "category": "system",
  "summary": "A local terminal for ThistleOS.",
  "description": "Terminal emulator for local system and development workflows.",
  "license": "BSD-3-Clause",
  "homepage": "https://github.com/wan0net/thistle-os",
  "source": "https://github.com/wan0net/thistle-os/tree/main/standalone_apps/terminal",
  "releases": [
    {
      "version": "0.1.0",
      "release_sequence": 1,
      "released": "2026-08-29",
      "changes": ["First TAP-packaged release"]
    }
  ]
}
