{
  "schema": "thistle.app.metadata/v1",
  "id": "com.example.hello",
  "category": "development",
  "summary": "Minimal example app for the ThistleOS SDK.",
  "description": "A small reference application demonstrating the standalone app lifecycle and SDK.",
  "license": "BSD-3-Clause",
  "homepage": "https://github.com/wan0net/thistle-os",
  "source": "https://github.com/wan0net/thistle-os/tree/main/standalone_apps/hello",
  "releases": [
    {
      "version": "1.0.0",
      "release_sequence": 1,
      "released": "2026-08-29",
      "changes": ["First TAP-packaged release"]
    }
  ]
}
