{
  "schema": "thistle.app.metadata/v1",
  "id": "com.thistle.flashlight",
  "category": "utilities",
  "summary": "A full-screen light with an SOS signal mode.",
  "description": "Use the display as a bright area light or play the SOS Morse pattern.",
  "license": "BSD-3-Clause",
  "homepage": "https://github.com/wan0net/thistle-os",
  "source": "https://github.com/wan0net/thistle-os/tree/main/standalone_apps/flashlight",
  "releases": [
    {
      "version": "2.0.0",
      "release_sequence": 1,
      "released": "2026-08-29",
      "changes": ["First TAP-packaged release"]
    }
  ]
}
